Stance on NN,Networking,format,Date Received,Type of Filing,Submission Type,Proceeding ID,Filing URL,Name of Filers(s),Comment Text,Total Page Count,Source,Memo,Date in the Document,Network 1,Network 2,Network 3,Network 4,Network 5,Network 6,Network 7,Network 8,Network 9,Network 10,Network 11,Network 12,Network 13,Network 14,Network 15,Network 16,Network 17,Network 18,Network 19,Network 20,Network 21,Network 22,Network 23,Network 24,Network 25,Network 26,Network 27,Network 28,Network 29,Network 30,Network 31,Network 32,Network 33,Network 34,Network 35,Network 36,Network 37,Network 38,Network 39,Network 40,Network 41,Network 42,Network 43,Network 44,Network 45,Network 46,Network 47,Network 48,Network 49,Network 50,Network 51,Network 52,Network 53,Network 54,Network 55,Network 56,Network 57,Network 58,Network 59,Network 60,Network 61,Network 62,Network 63,Network 64,Network 65,Network 66,Network 67,Network 68,Network 69,Network 70,Network 71,Network 72,Network 73,Network 74,Network 75,Network 76,Network 77,Network 78,Network 79,Network 80,Network 81,Network 82,Network 83,Network 84,Network 85,Network 86,Network 87,Network 88,Network 89,Network 90,Network 91,Network 92,Network 93,Network 94,Network 95,Network 96,Network 97,Network 98,Network 99,Network 100,Network 101,Network 102,Network 103,Network 104,Network 105,Network 106,Network 107,Network 108,Network 109,Network 110,Network 111,Network 112,Network 113,Network 114,Network 115,Network 116,Network 117,Network 118,Network 119,Network 120,Network 121,Network 122,Network 123,Network 124,Network 125,Network 126,Network 127,Network 128,Network 129,Network 130,Network 131,Network 132,Network 133,Network 134,Network 135,Network 136,Network 137,Network 138,Network 139,Network 140,Network 141,Network 142,Network 143,Network 144,Network 145,Network 146,Network 147,Network 148,Network 149,Network 150,Network 151,Network 152,Network 153,Network 154,Network 155,Network 156,Network 157,Network 158,Network 159,Network 160,Network 161,Network 162,Network 163,Network 164,Network 165,Network 166,Network 167,Network 168,Network 169,Network 170,Network 171,Network 172,Network 173,Network 174,Network 175,Network 176,Network 177,Network 178,Network 179,Network 180,Network 181,Network 182,Network 183,Network 184,Network 185,Network 186
Anti,Network,Comment (Letter?),11/21/2017,COMMENT,STANDARD,17-108,https://www.fcc.gov/ecfs/search/search-filings/filing/11211479014964,Municipal Broadband ISPs in Support of Internet Freedom,Refer to Attachment(s).,3,https://www.fcc.gov/ecfs/document/11211479014964/1,12 Municipal ISPs,11/21/2017,"BELD Broadband, Braintree, MA","Community Telecom Services, Monticello, KY","San Bruno Municipal Cable TV, San Bruno, CA","City of Barnesville Municipal Broadband and Internet, MN","Glasgow EPB, Glasgow, KY","Spencer Municipal Utilities, Spencer, IA","Scottsboro Power Board, Scottsboro, AL","Click! Network, Tacoma, WA","MINET, Monmouth-Independence Network, Monmouth, OR","Murray Electric System, Murray, KY","Laurens Municipal Power & Communications, Laurens, IA","Wyandotte Cable, Wyandotte, MI",,,,,,,,,,,,,,,,,,,,,,,,,,,,,,,,,,,,,,,,,,,,,,,,,,,,,,,,,,,,,,,,,,,,,,,,,,,,,,,,,,,,,,,,,,,,,,,,,,,,,,,,,,,,,,,,,,,,,,,,,,,,,,,,,,,,,,,,,,,,,,,,,,,,,,,,,,,,,,,,,,,,,,,,,,,,,,
Pro,Network,Comments,7/18/2017,COMMENT,STANDARD,17-108,https://www.fcc.gov/ecfs/search/search-filings/filing/107182762524959,"Access Now, Epicenter.works (Austria), La Quadrature du Net (France), Electronic Frontier Norway, IT-POL Denmark, Digitalcourage (Germany), European Digital Rights (EDRi)",Refer to Attachment(s).,32,https://www.fcc.gov/ecfs/document/107182762524959/1,Access,7/17/2017,Access,epicenter.works (Austria),La Quadrature du Net (France),Electronic Frontier Norway,IT-POL Denmark,Digitalcourage (Germany),European Digital Rights (EDRi),,,,,,,,,,,,,,,,,,,,,,,,,,,,,,,,,,,,,,,,,,,,,,,,,,,,,,,,,,,,,,,,,,,,,,,,,,,,,,,,,,,,,,,,,,,,,,,,,,,,,,,,,,,,,,,,,,,,,,,,,,,,,,,,,,,,,,,,,,,,,,,,,,,,,,,,,,,,,,,,,,,,,,,,,,,,,,,,,,,
Pro,Network,Comments,7/19/2017,"ERRATA, ERRATUM OR ADDENDUM",STANDARD,17-108,https://www.fcc.gov/ecfs/search/search-filings/filing/10719107449178,"the Attorneys General of the States of Illinois, California, Connecticut, Hawaii, Iowa, Maine, Maryland, Massachusetts, Mississippi, Oregon, Vermont, Washington, Rhode Island and the District of Columbia",Refer to Attachment(s).,26,https://www.fcc.gov/ecfs/document/10719107449178/2,Atty's General et al.,5/18/2017,Attorney General of Illinois,Attorney General of California,Attorney General of Connecticut,District of Columbia Attorney General,Attorney General of Hawaii,"Executive Director Hawaii, Office of Consumer Protection",Attorney General of Iowa,Attorney General of Maine,Attorney General of Maryland,Attorney General of Massachusetts,Attorney General of Mississippi,Attorney General of Oregon,Attorney General of Rhode Island,Attorney General of Vermont,Attorney General of Washington State,,,,,,,,,,,,,,,,,,,,,,,,,,,,,,,,,,,,,,,,,,,,,,,,,,,,,,,,,,,,,,,,,,,,,,,,,,,,,,,,,,,,,,,,,,,,,,,,,,,,,,,,,,,,,,,,,,,,,,,,,,,,,,,,,,,,,,,,,,,,,,,,,,,,,,,,,,,,,,,,,,,,,,,,,,,
