Pro,Network,Comments,7/12/2017,COMMENT,STANDARD,17-108,https://www.fcc.gov/ecfs/search/search-filings/filing/10712307619992,"Mayor Edwin M. Lee, City and County of San Francisco",Refer to Attachment(s).,3,https://www.fcc.gov/ecfs/document/10712307619992/1,Net Neutrality Day of Action Mayors (7/17 list added),7/12/2017,"Mayor Edwin M. Lee, City and County of San Francisco","Mayor Bill de Blasio, City of New York, New York","Mayor Martin J. Walsh, City of Boston, Massachusetts","Mayor Muriel Bowser, District of Columbia","Mayor Ed Murray, City of Seattle, Washington","Mayor Rahm Emanuel, City of Chicago, Illinois","Mayor Allison Silberberg, City of Alexandria, Virginia","Mayor Dana Kirkham, City of Ammon, Idaho","Mayor Ben Kessler, City of Bexley, Ohio","Melvin Kleckner, Town Administrator, Town of Brookline, Massachusetts","Mayor Deborah Frank Feinen, City of Champaign, Illinois","Mayor Andy Berke, City of Chattanooga, Tennessee","Mayor Mary Casillas Salas, City of Chula Vista, California","Mayor Kim McMillan, City of Clarksville, Tennessee","Mayor John Woods, Town of Davidson, North Carolina","Mayor Lucy Vinis, City of Eugene, Oregon","Mayor Lioneld Jordan, City of Fayetteville, Arkansas","Mayor William McLeod, Village of Hoffman Estates, Illinois","Chairman Archibald L. Gillies, Islesboro Board of Selectmen, Town of Islesboro, Maine","Peter D'Errico, Chair of Select Board, Town of Leverett, Massachusetts","Mayor Chris Beutler, City of Lincoln, Nebraska","Edward J. Kennedy, City of Lowell, Massachusetts","Mayor Paul Soglin, City of Madison, Wisconsin","Mayor Alex Morcos, City of Medina, Washington","Mayor Betsy Hodges, City of Minneapolis, Minnesota","Hans Riemer, Council Vice President, Montgomery County, Maryland","Mayor Jennifer Gregerson, City of Mukilteo, Washington","Mayor Megan Barry, Metropolitan Nashville & Davidson County, Tennessee","Mayor Jon Mitchell, City of New Bedford, Massachusetts","Mayor David J. Narkewicz, City of Northampton, Massachusetts","Mayor Libby Schaaf, City of Oakland, California","Mayor Greg Stanton, City of Phoenix, Arizona","Mayor Ted Wheeler, City of Portland, Oregon","Mayor Tom Butt, City of Richmond, California","Mayor Ron Nirenberg, City of San Antonio, Texas","Mayor Sam Liccardo, City of San Jose, California","Mayor Pauline Russo Cutter, City of San Leandro, California","Zach Friend, Vice Chair, Santa Cruz County Board of Supervisors, Santa Cruz County, California","Mayor Ted Winterer, City of Santa Monica, California","Mayor Joanne Dittes Yepsen, City of Saratoga Springs, New York","Mayor Gary R. McCarthy, City of Schenectady, New York","Mayor Patricia Smith, City of South Portland, Maine","Mayor Christine Lundberg, City of Springfield, Oregon","Mayor Stephanie Miner, City of Syracuse, New York","Mayor Marilyn Strickland, City of Tacoma, Washington","Mayor Diane Wolfe Marlin, City of Urbana, Illinois","Mayor William D. Sessoms, City of Virginia Beach, Virginia","Mayor John Heilman, City of West Hollywood, California","Mayor Joe Dominick, City of Westminster, Maryland","Mayor Gary Resnick, City of Wilton Manors, Florida","Mayor Steve Adler, City of Austin, Texas","Mayor Jesse Arreguin, City of Berkeley, California","Mayor E. Denise Simmons, City of Cambridge, Massachusetts","Mayor David Baker, City of Kenmore, Washington","Mayor Mark Gamba, City of Milwaukie, Oregon","Mayor Toni N. Harp, City of New Haven, Connecticut","Mayor William Peduto, City of Pittsburgh, Pennsylvania","Mayor Sherman P. Lea, Sr., City of Roanoke, Virginia","Mayor Byron Randolph Foley, City of Salem, Virginia","Mayor Cynthia Chase, City of Santa Cruz, California","Mayor David R. Martin, City of Stamford, Connecticut","Mayor Elizabeth Goreham, Borough of State College, Pennsylvania",,,,,,,,,,,,,,,,,,,,,,,,,,,,,,,,,,,,,,,,,,,,,,,,,,,,,,,,,,,,,,,,,,,,,,,,,,,,,,,,,,,,,,,,,,,,,,,,,,,,,,,,,,,,,,,,,,,,,,,,,,,,
Pro,Network,Comments,7/17/2017,COMMENT,STANDARD,17-108,https://www.fcc.gov/ecfs/search/search-filings/filing/1071799489959,"American Association of Community Colleges, American Association of State Colleges and Universities, American Council on Education, Association of American Universities, Association of Public and Land-grant Universities, Association of Research Libraries, EDUCAUSE,, National Association of College and University Business Officers, National Association of Independent Colleges and Universities",Refer to Attachment(s).,40,https://www.fcc.gov/ecfs/document/1071799489959/1,,7/17/2017,American Council on Education,American Association of Community Colleges,American Association of State Colleges & Universities,Association of American Universities,Association of Public and Land-grant Universities,National Association of Independent Colleges & Universities,EDUCAUSE,Association of Research Libraries,National Association of College & University Business Officers,,,,,,,,,,,,,,,,,,,,,,,,,,,,,,,,,,,,,,,,,,,,,,,,,,,,,,,,,,,,,,,,,,,,,,,,,,,,,,,,,,,,,,,,,,,,,,,,,,,,,,,,,,,,,,,,,,,,,,,,,,,,,,,,,,,,,,,,,,,,,,,,,,,,,,,,,,,,,,,,,,,,,,,,,,,,,,,,,
Pro,Network,Comments,7/17/2017,COMMENT,STANDARD,17-108,https://www.fcc.gov/ecfs/search/search-filings/filing/10717218515721,"American Library Association, Chief Officers of State Library Agencies, American Association of Law Libraries",Refer to Attachment(s).,32,https://www.fcc.gov/ecfs/document/10717218515721/1,,7/17/2017,American Library Association,American Association of Law Libraries,Chief Officers of State Library Agencies,,,,,,,,,,,,,,,,,,,,,,,,,,,,,,,,,,,,,,,,,,,,,,,,,,,,,,,,,,,,,,,,,,,,,,,,,,,,,,,,,,,,,,,,,,,,,,,,,,,,,,,,,,,,,,,,,,,,,,,,,,,,,,,,,,,,,,,,,,,,,,,,,,,,,,,,,,,,,,,,,,,,,,,,,,,,,,,,,,,,,,,
Pro,Network,Comments,7/17/2017,COMMENT,STANDARD,17-108,https://www.fcc.gov/ecfs/search/search-filings/filing/10717749606812,California Association of REALTORS,Refer to Attachment(s).,2,https://www.fcc.gov/ecfs/document/10717749606812/1,,7/17/2017,California Association of Realtors,National Association of Realtors,,,,,,,,,,,,,,,,,,,,,,,,,,,,,,,,,,,,,,,,,,,,,,,,,,,,,,,,,,,,,,,,,,,,,,,,,,,,,,,,,,,,,,,,,,,,,,,,,,,,,,,,,,,,,,,,,,,,,,,,,,,,,,,,,,,,,,,,,,,,,,,,,,,,,,,,,,,,,,,,,,,,,,,,,,,,,,,,,,,,,,,,
Pro,Network,Comments,7/17/2017,COMMENT,STANDARD,17-108,https://www.fcc.gov/ecfs/search/search-filings/filing/10717117909818,"Data Foundry, Inc. and Golden Frog GmbH",Refer to Attachment(s).,49,https://www.fcc.gov/ecfs/document/10717117909818/1,,7/17/2017,Data Foundry,Golden Frog GmbH,,,,,,,,,,,,,,,,,,,,,,,,,,,,,,,,,,,,,,,,,,,,,,,,,,,,,,,,,,,,,,,,,,,,,,,,,,,,,,,,,,,,,,,,,,,,,,,,,,,,,,,,,,,,,,,,,,,,,,,,,,,,,,,,,,,,,,,,,,,,,,,,,,,,,,,,,,,,,,,,,,,,,,,,,,,,,,,,,,,,,,,,
Pro,Network,Comments,7/17/2017,COMMENT,STANDARD,17-108,https://www.fcc.gov/ecfs/search/search-filings/filing/107172157607219,Harold Furchtgott-Roth and Washington Legal Foundation,Refer to Attachment(s).,12,https://www.fcc.gov/ecfs/document/107172157607219/1,,7/17/2017,FCC former Commissioner Harold Furchtgott-Roth,Washington Legal Foundation,,,,,,,,,,,,,,,,,,,,,,,,,,,,,,,,,,,,,,,,,,,,,,,,,,,,,,,,,,,,,,,,,,,,,,,,,,,,,,,,,,,,,,,,,,,,,,,,,,,,,,,,,,,,,,,,,,,,,,,,,,,,,,,,,,,,,,,,,,,,,,,,,,,,,,,,,,,,,,,,,,,,,,,,,,,,,,,,,,,,,,,,
Pro,Network,Comments,7/17/2017,COMMENT,STANDARD,17-108,https://www.fcc.gov/ecfs/search/search-filings/filing/10717278379812,"Floor64, Inc.,, Techdirt, Copia Institute",Refer to Attachment(s).,7,https://www.fcc.gov/ecfs/document/10717278379812/1,,7/17/2017,Floor64,Copia Institute,Techdirt,,,,,,,,,,,,,,,,,,,,,,,,,,,,,,,,,,,,,,,,,,,,,,,,,,,,,,,,,,,,,,,,,,,,,,,,,,,,,,,,,,,,,,,,,,,,,,,,,,,,,,,,,,,,,,,,,,,,,,,,,,,,,,,,,,,,,,,,,,,,,,,,,,,,,,,,,,,,,,,,,,,,,,,,,,,,,,,,,,,,,,,
Pro,Network,Comments,7/18/2017,COMMENT,STANDARD,17-108,https://www.fcc.gov/ecfs/search/search-filings/filing/107182206301826,"CASH Music, Future of Music Coalition",Refer to Attachment(s).,3,https://www.fcc.gov/ecfs/document/107182206301826/1,,7/17/2017,Future of Music Coalition,CASH Music,American Association of Independent Music,Atlantic Rhythms,Bad Friend Records,Bloodshot Records,Cuneiform Records,Dischord,Don Giovanni Records,DZ Tapes,JMC Aggregate,Kill Rock Stars,Merge Records,Partisan Records,Regalia Records,Secretly Group,Sister Polygon Records,Slumberland Records,Tape Modulator,Thirsty Ear Recordings,Top Shelf Records,,,,,,,,,,,,,,,,,,,,,,,,,,,,,,,,,,,,,,,,,,,,,,,,,,,,,,,,,,,,,,,,,,,,,,,,,,,,,,,,,,,,,,,,,,,,,,,,,,,,,,,,,,,,,,,,,,,,,,,,,,,,,,,,,,,,,,,,,,,,,,,,,,,,,,,,,,,,,,,,,,,,,
Pro,Network,Comments,7/17/2017,COMMENT,STANDARD,17-108,https://www.fcc.gov/ecfs/search/search-filings/filing/107171368516627,"National Consumer Law Center, United Church of Christ, OC Inc.",Refer to Attachment(s).,9,https://www.fcc.gov/ecfs/document/107171368516627/1,,7/17/2017,National Consumer Law Center,United Church of Christ OC,,,,,,,,,,,,,,,,,,,,,,,,,,,,,,,,,,,,,,,,,,,,,,,,,,,,,,,,,,,,,,,,,,,,,,,,,,,,,,,,,,,,,,,,,,,,,,,,,,,,,,,,,,,,,,,,,,,,,,,,,,,,,,,,,,,,,,,,,,,,,,,,,,,,,,,,,,,,,,,,,,,,,,,,,,,,,,,,,,,,,,,,
Pro,Network,Comments,7/17/2017,COMMENT,STANDARD,17-108,https://www.fcc.gov/ecfs/search/search-filings/filing/1071757487036,"NTCH, Inc. and Flat Wireless, LLC",Refer to Attachment(s).,22,https://www.fcc.gov/ecfs/document/1071757487036/1,,7/17/2017,NTCH,Flat Wireless,,,,,,,,,,,,,,,,,,,,,,,,,,,,,,,,,,,,,,,,,,,,,,,,,,,,,,,,,,,,,,,,,,,,,,,,,,,,,,,,,,,,,,,,,,,,,,,,,,,,,,,,,,,,,,,,,,,,,,,,,,,,,,,,,,,,,,,,,,,,,,,,,,,,,,,,,,,,,,,,,,,,,,,,,,,,,,,,,,,,,,,,
Pro,Network,Comments,7/19/2017,COMMENT,STANDARD,17-108,https://www.fcc.gov/ecfs/search/search-filings/filing/1071932385942,"Public Knowledge, Common Cause",Refer to Attachment(s).,140,https://www.fcc.gov/ecfs/document/1071932385942/1,,7/17/2017,Public Knowledge,Common Cause,,,,,,,,,,,,,,,,,,,,,,,,,,,,,,,,,,,,,,,,,,,,,,,,,,,,,,,,,,,,,,,,,,,,,,,,,,,,,,,,,,,,,,,,,,,,,,,,,,,,,,,,,,,,,,,,,,,,,,,,,,,,,,,,,,,,,,,,,,,,,,,,,,,,,,,,,,,,,,,,,,,,,,,,,,,,,,,,,,,,,,,,
Pro,Network,Comments,7/17/2017,COMMENT,STANDARD,17-108,https://www.fcc.gov/ecfs/search/search-filings/filing/107170878620882,"Scaramella & Hoofnagle, Computer Division, Adept Data Systems, L.L.C.",Refer to Attachment(s).,5,https://www.fcc.gov/ecfs/document/107170878620882/1,,7/17/2017,Scaramella & Hoofnagle,Adept Data Systems,,,,,,,,,,,,,,,,,,,,,,,,,,,,,,,,,,,,,,,,,,,,,,,,,,,,,,,,,,,,,,,,,,,,,,,,,,,,,,,,,,,,,,,,,,,,,,,,,,,,,,,,,,,,,,,,,,,,,,,,,,,,,,,,,,,,,,,,,,,,,,,,,,,,,,,,,,,,,,,,,,,,,,,,,,,,,,,,,,,,,,,,
Pro,Network,Comments,7/17/2017,COMMENT,STANDARD,"14-28, 17-108",https://www.fcc.gov/ecfs/search/search-filings/filing/1071783345674,"Telecommunications for the Deaf and Hard of Hearing, Inc. (TDI), National Association of the Deaf (NAD), Hearing Loss Association of America (HLAA), American Council of the Blind (ACB), Association of Late-Deafened Adults (ALDA), Cerebral Palsy and Deaf Organization (CPADO), Deaf and Hard of Hearing Consumer Advocacy Network (DHHCAN), Deaf/Hard of Hearing Technology Rehabilitation Engineering Research Center (DHH-RERC), Universal Interfaces and Information Technology Access Rehabilitation Engineering Research Center (UIITA-RERC), Prof. Clayton Lewis",Refer to Attachment(s).,20,https://www.fcc.gov/ecfs/document/1071783345674/1,,7/17/2017,Telecommunications for the Deaf & Hard of Hearing,National Association of the Deaf,Hearing Loss Association of America,American Council of the Blind,Association of Late-Deafened Adults,Cerebral Palsy & Deaf Organization,Deaf & Hard of Hearing Consumer Advocacy Network,Deaf/Hard of Hearing Technology Rehabilitation Engineering Research Center,Universal Interfaces & Information Technology Access Rehabilitation Engineering Research Center,"Clayton Lewis, University of Colorado Boulder",,,,,,,,,,,,,,,,,,,,,,,,,,,,,,,,,,,,,,,,,,,,,,,,,,,,,,,,,,,,,,,,,,,,,,,,,,,,,,,,,,,,,,,,,,,,,,,,,,,,,,,,,,,,,,,,,,,,,,,,,,,,,,,,,,,,,,,,,,,,,,,,,,,,,,,,,,,,,,,,,,,,,,,,,,,,,,,,
Pro,Network,Comments,7/18/2017,COMMENT,STANDARD,17-108,https://www.fcc.gov/ecfs/search/search-filings/filing/107180225124760,Members of the New York City Council,Refer to Attachment(s).,6,https://www.fcc.gov/ecfs/document/107180225124760/1,,7/17/2017,The Council of the City of New York,NYC Council Member Ben Kallos,NYC Council Member Corey Johnson,NYC Council Member Stephen T. Levin,NYC Council Member Mark Levine,NYC Council Member Carlos Menchaca,NYC Council Member Antonio Reynoso,NYC Council Member Donovan Richards,NYC Council Member Ydanis Rodriguez,NYC Council Member Deborah Rose,NYC Council Member Helen Rosenthal,NYC Council Member Ritchie Torres,,,,,,,,,,,,,,,,,,,,,,,,,,,,,,,,,,,,,,,,,,,,,,,,,,,,,,,,,,,,,,,,,,,,,,,,,,,,,,,,,,,,,,,,,,,,,,,,,,,,,,,,,,,,,,,,,,,,,,,,,,,,,,,,,,,,,,,,,,,,,,,,,,,,,,,,,,,,,,,,,,,,,,,,,,,,,,
Pro,Network,Comments,8/16/2017,COMMENT,STANDARD,17-108,https://www.fcc.gov/ecfs/search/search-filings/filing/10816116080355,United Nations Special Rapporteur on Freedom of Expression; Special Rapporteur for Freedom of Expression of the Inter-American Commission on Human Rights,Refer to Attachment(s).,8,https://www.fcc.gov/ecfs/document/10816116080355/1,,8/17/2017,United Nations Special Rapporteur on Freedom of Expression,Special Rapporteur for Freedom of Expression of the Inter-American Commission on Human Rights,,,,,,,,,,,,,,,,,,,,,,,,,,,,,,,,,,,,,,,,,,,,,,,,,,,,,,,,,,,,,,,,,,,,,,,,,,,,,,,,,,,,,,,,,,,,,,,,,,,,,,,,,,,,,,,,,,,,,,,,,,,,,,,,,,,,,,,,,,,,,,,,,,,,,,,,,,,,,,,,,,,,,,,,,,,,,,,,,,,,,,,,
Pro,Network,Comments,8/4/2017,COMMENT,STANDARD,17-108,https://www.fcc.gov/ecfs/search/search-filings/filing/108042950005661,"Representative Frank Pallone, Jr. et al.",Refer to Attachment(s).,20,https://www.fcc.gov/ecfs/document/108042950005661/1,,8/4/2017,"US Rep. Frank Pallone, Jr.",US Rep. Mike Doyle,US Rep. Anna G. Eshoo,US Rep. Diana DeGette,US Rep. Jan Schakowsky,US Rep. Doris Matsui,US Rep. Kathy Castor,US Rep. John Sarbanes,US Rep. Jerry McNerney,US Rep. Peter Welch,US Rep. Joseph P. Kennedy III,,,,,,,,,,,,,,,,,,,,,,,,,,,,,,,,,,,,,,,,,,,,,,,,,,,,,,,,,,,,,,,,,,,,,,,,,,,,,,,,,,,,,,,,,,,,,,,,,,,,,,,,,,,,,,,,,,,,,,,,,,,,,,,,,,,,,,,,,,,,,,,,,,,,,,,,,,,,,,,,,,,,,,,,,,,,,,,
Pro,Network,Comments,7/20/2017,COMMENT,STANDARD,17-108,https://www.fcc.gov/ecfs/search/search-filings/filing/107202424413478,United Church of Christ OC,Refer to Attachment(s).,122,https://www.fcc.gov/ecfs/document/107202424413478/1,,7/19/2017,Voices for Internet Freedom,National Hispanic Media Coalition,Free Press,Center for Media Justice,ColorOfChange,18MillionRising,Access Humboldt,Appalshop,Arts & Democracy,Allied Media Projects,BYP100,Center for Social Inclusion,Chinese Progressive Association,Common Cause,Common Frequency,#Cut50,DigiColor,Dignity & Power Now,Dream Corps,Equality labs,Families for Freedom,Forward Together,Families Rally for Emancipation & Empowerment,Generation Justice,Global Action Project,Hollaback!,Human Pictures,Ignite NC,Instituto de Educacion Popular del Sur de California,KRSM Radio,Latino Rebels,Line Break Media,Livier Productions,#LoveArmy,May First/People Link,Media Action Center,Media Alliance,Media Mobilizing Project,MPower Change,MomsRising,Movement Strategy Center,Native Public Media,New Sanctuary Coalition,Open Access Connections,Ohio Valley Environmental Coalition,Parks & Power,People's Action,Presente,Prometheus Radio Project,Race Forward,Rebuild the Dream,Somos Un Pueblo Unido,Stop LAPD Spying Coalition,United Church of Christ OC,Urbana Champaign Independent Media Center,Voices for Racial Justice,Washington Peace Center,Whitman Institute,WFNU Frogtown Community Radio,WITNESS,Working Narratives,#YesWeCode,,,,,,,,,,,,,,,,,,,,,,,,,,,,,,,,,,,,,,,,,,,,,,,,,,,,,,,,,,,,,,,,,,,,,,,,,,,,,,,,,,,,,,,,,,,,,,,,,,,,,,,,,,,,,,,,,,,,,,,,,,,,
Anti,Network,Comments,7/17/2017,COMMENT,STANDARD,17-108,https://www.fcc.gov/ecfs/search/search-filings/filing/10717270130047,Coalition of 17 Small and Mid-Size Manufacturers of Products for Broadband Networks,Refer to Attachment(s).,7,https://www.fcc.gov/ecfs/document/10717270130047/1,17 Small and Mid-Size Manufacturers,7/17/2017,Actiontec,Adara Technologies,Argent Associates,Blonder Tongue,CBM of America,Condux International,ETI Software Solutions,FiberControl,FiberSource,Go! Foton,Infinera,Nextus,Prysmian Communications Cables & Systems,Sentinel Connector Systems,SNC Manufacturing,Vermeer,Voltserver,,,,,,,,,,,,,,,,,,,,,,,,,,,,,,,,,,,,,,,,,,,,,,,,,,,,,,,,,,,,,,,,,,,,,,,,,,,,,,,,,,,,,,,,,,,,,,,,,,,,,,,,,,,,,,,,,,,,,,,,,,,,,,,,,,,,,,,,,,,,,,,,,,,,,,,,,,,,,,,,,,,,,,,,,
Anti,Network,Comments,7/17/2017,COMMENT,STANDARD,17-108,https://www.fcc.gov/ecfs/search/search-filings/filing/107172395423283,"Grover G. Norquist, Americans For Tax Reform, Governor Paul LePage, Leigh Hixon, Alabama POlicy Institute, Phil Kerpen, American Commitment, Daniel Schneider, American Conservative Union, Steve Pociask, American Consumer Institute, Lisa Nelson, ALEC, Christine Harbin, AMericans for Prosperity, Robert Alt, The Buckeye Institute, Jeffrey Mazzella, Center for Individual Freedom, Chuck Muth, Citizen Outreach, Grant Maloy, Center Right Coalition of Orlando, Michael J. Bowen, Coalition for a Strong America, Mike Krause, Independence Institute, Andrew Langer, Institute for Liberty, Tom Giovanetti, Institute for Policy Innovation, Matthew Kandrach, Consumer Action for a Strong Economy, Col. Francis X. De Luca USMR (Ret), Civitas Institute, Katie McAuliffe, Digital Liberty, Hance Haney, Discovery Institute, Seton Motley, Less Government, Daniel Garza, The LIBRE Inititive, Adam Brandon, FreedomWorks, Bartlett Cleland, Madery Bridge, Dee Hodges, Maryland Taxpayers Association, Annette Meeks, Freedom Foundation of Minnesota, Mike Wendy, Media Freedom, Richard Watson, Florida Center/Right Coalition, Henry Kriegel, Montanans for Tax Reform, David Barnes, Generation Opportunity, Brent Mead, Montana Policy Institute, Joseph Bast, The Heartland Institute, Scott Cleland, NetCompetition, Lorenzo Montanari, Property Rights Alliance, Don Racheter, Public Interest Institute, Mary Adam, Maine Center-Right Coalition, Mike Stenhouse, Rhode Island Center for Freedom & Prospertiy, Paul Gessing, Rio Grande Foundation, Tom Struble, R Street Institute, Karen Kerrigan, Small Buisness & Entrepreneurship Council, James L. Martin, 60 Plus Association, David Williams, Taxpayers Protection Alliance, Berin Szoka, TechFreedom, Gerrye Johnston, Women for Democracy in America, Jim Goff, Penny Morrell, Susan Hamill, Victoria Bucklin, Susan Dench, Bryan Dench, Esq., Pem Schaeffer, Robert Stone, Tom Davis, Hon. William O'Brien, New Hampshire Center RIght Coalition, Hon. Stephen Stepanek, New Hampshire Center Right Coalition, Hon. Norman Tregenza, Hon. Paul Mirski, Rep. Peter Hansen, Hillsborough County (NH) District 22, Rep. David Murotake Hillsborough County (NH) District 32, Representative James Spillane Rockingham County (NH) District 2, Representative Joe Pitre Strafford County (NH) District 2, Representative Greg Hill Merrimack County (NH) District 3, Representative Chris True Rockingham County (NH) District 4, Representative Jorden Ulery Hillsborough County (NH) District 37, Representative Carol McGuire Merrimack County (NH) District 29, Representative Dan Itse Rockingham County (NH) District 10, The Honorable Joe Duarte Former state representative, Rockingham County (NH), Representative Kurt Wuelper Strafford County (NH) District 3",Refer to Attachment(s).,14,https://www.fcc.gov/ecfs/document/107172395423283/2,,7/17/2017,Coalition of 65 Submit,FreedomWorks,Americans for Tax Reform,Alabama Policy Institute,American Commitment,American Conservative Union,American Consumer Institute,"Governor Paul LePage, Maine",American Legislative Exchange Council,Americans for Prosperity,Buckeye Institute,Center for Individual Freedom,Center Right Coalition of Orlando,Citizen Outreach,Coalition for a Strong America,Consumer Action for a Strong Economy,Civitas Institute,Digital Liberty,Discovery Institute,Freedom Foundation of Minnesota,Florida Center/Right Coalition,Generation Opportunity,Granite State Taxpayers,Heartland Institute,Independence Institute,Institute for Liberty,Institute for Policy Innovation,Less Government,LIBRE Inititive,Madery Bridge,Maryland Taxpayers Association,MediaFreedom,Montanans for Tax Reform,Montana Policy Institute,NetCompetition,Property Rights Alliance,Public Interest Institute,Rhode Island Center for Freedom & Prospertiy,Rio Grande Foundation,R Street Institute,Small Buisness & Entrepreneurship Council,60 Plus Association,Taxpayers Protection Alliance,TechFreedom,Women for Democracy in America,Maine Center-Right Coalition,New Hampshire Center Right Coalition,"Norman Tregenza, Former State Representative, Carroll County (NH) District 2","Paul Mirski, Former State Representative, Grafton County (NH)","Representative Peter Hansen, Hillsborough County (NH) District 22",Representative David Murotake Hillsborough County (NH) District 32,Representative Jorden Ulery Hillsborough County (NH) District 3,Representative Greg Hill Merrimack County (NH) District 3,Representative Carol McGuire Merrimack County (NH) District 29,Representative Chris True Rockingham County (NH) District 4,Representative Dan Itse Rockingham County (NH) District 10,"Joe Duarte, Former State Representative, Rockingham County (NH)",Representative Joe Pitre Strafford County (NH) District 2,Representative Kurt Wuelper Strafford County (NH) District 3,,,,,,,,,,,,,,,,,,,,,,,,,,,,,,,,,,,,,,,,,,,,,,,,,,,,,,,,,,,,,,,,,,,,,,,,,,,,,,,,,,,,,,,,,,,,,,,,,,,,,,,,,,,,,,,,,,,,,,,,,,,,,,,
Anti,Network,Comments,7/18/2017,COMMENT,STANDARD,17-108,https://www.fcc.gov/ecfs/search/search-filings/filing/1071865963004,"Directors Guild of America, Screen Actors Guild-American Federation of Television and Radio Artists",Refer to Attachment(s).,5,https://www.fcc.gov/ecfs/document/1071865963004/1,,7/18/2017,Directors Guild of America,Screen Actors Guild,American Federation of Television & Radio Artists,,,,,,,,,,,,,,,,,,,,,,,,,,,,,,,,,,,,,,,,,,,,,,,,,,,,,,,,,,,,,,,,,,,,,,,,,,,,,,,,,,,,,,,,,,,,,,,,,,,,,,,,,,,,,,,,,,,,,,,,,,,,,,,,,,,,,,,,,,,,,,,,,,,,,,,,,,,,,,,,,,,,,,,,,,,,,,,,,,,,,,,
Anti,Network,Comments,7/17/2017,COMMENT,STANDARD,17-108,https://www.fcc.gov/ecfs/search/search-filings/filing/1071757324988,Staff of the Federal Trade Commission,Refer to Attachment(s).,30,https://www.fcc.gov/ecfs/document/1071757324988/1,,7/17/2017,"Federal Trade Commission, Bureau of Consumer Protection, Thomas B. Pahl","Federal Trade Commission, Bureau of Competition, Markus H. Meier","Federal Trade Commission, Bureau of Economics, Ginger Z. Jin",,,,,,,,,,,,,,,,,,,,,,,,,,,,,,,,,,,,,,,,,,,,,,,,,,,,,,,,,,,,,,,,,,,,,,,,,,,,,,,,,,,,,,,,,,,,,,,,,,,,,,,,,,,,,,,,,,,,,,,,,,,,,,,,,,,,,,,,,,,,,,,,,,,,,,,,,,,,,,,,,,,,,,,,,,,,,,,,,,,,,,,
Anti,Network,Comments,7/17/2017,COMMENT,STANDARD,17-108,https://www.fcc.gov/ecfs/search/search-filings/filing/10717984806322,"Hispanic Technology and Telecommuncations Partnership and MANA, A National Latina Organization",Refer to Attachment(s).,3,https://www.fcc.gov/ecfs/document/10717984806322/1,,7/17/2017,Hispanic Technology & Telecommunications Partnership,MANA - A National Latina Organization,,,,,,,,,,,,,,,,,,,,,,,,,,,,,,,,,,,,,,,,,,,,,,,,,,,,,,,,,,,,,,,,,,,,,,,,,,,,,,,,,,,,,,,,,,,,,,,,,,,,,,,,,,,,,,,,,,,,,,,,,,,,,,,,,,,,,,,,,,,,,,,,,,,,,,,,,,,,,,,,,,,,,,,,,,,,,,,,,,,,,,,,
Anti,Network,Comments,7/17/2017,COMMENT,STANDARD,17-108,https://www.fcc.gov/ecfs/search/search-filings/filing/10717552206928,"Judicial Watch, Inc., Allied Educational Foundation",Refer to Attachment(s).,18,https://www.fcc.gov/ecfs/document/10717552206928/1,,7/17/2017,Judicial Watch,Allied Educational Foundation,,,,,,,,,,,,,,,,,,,,,,,,,,,,,,,,,,,,,,,,,,,,,,,,,,,,,,,,,,,,,,,,,,,,,,,,,,,,,,,,,,,,,,,,,,,,,,,,,,,,,,,,,,,,,,,,,,,,,,,,,,,,,,,,,,,,,,,,,,,,,,,,,,,,,,,,,,,,,,,,,,,,,,,,,,,,,,,,,,,,,,,,
Anti,Network,Comments,7/18/2017,COMMENT,STANDARD,17-108,https://www.fcc.gov/ecfs/search/search-filings/filing/107180282417781,"Asian Pacific American Institute of Congressional Studies (APAICS), Consumer Policy Solutions, Hispanic Technology & Telecommunications Partnership (HTTP), League of United Latin American Citizens (LULAC), MANA, A National Latina Organization, Multicultural Media, Telecom & Internet Council (MMTC), National Black Caucus of State Legislators (NBCSL), National Coalition on Black Civic Participation (NCBCP), National Congress of Black Women (NCBW), National Organization of Black County Officials (NOBCO), National Organization of Black Elected Legislative Women (NOBEL Women), National Puerto Rican Chamber of Commerce, OCA - Asian Pacific American Advocates, U.S. Hispanic Chamber of Commerce",Refer to Attachment(s).,34,https://www.fcc.gov/ecfs/document/107180282417781/1,,7/17/2017,National Multicultural Organizations,Asian Pacific American Institute for Congressional Studies,Consumer Policy Solutions,Hispanic Technology & Telecommunications Partnership,League of United Latin American Citizens,MANA - A National Latina Organization,"Multicultural Media, Telecom & Internet Council",National Black Caucus of State Legislators,National Coalition on Black Civic Participation,National Congress of Black Women,National Organization of Black County Officials,National Organization of Black Elected Legislative Women,National Puerto Rican Chamber of Commerce,Asian Pacific American Advocates,United States Hispanic Chamber of Commerce,Organization of Chinese Americans,,,,,,,,,,,,,,,,,,,,,,,,,,,,,,,,,,,,,,,,,,,,,,,,,,,,,,,,,,,,,,,,,,,,,,,,,,,,,,,,,,,,,,,,,,,,,,,,,,,,,,,,,,,,,,,,,,,,,,,,,,,,,,,,,,,,,,,,,,,,,,,,,,,,,,,,,,,,,,,,,,,,,,,,,,
