Anti,Network,Comments,7/11/2017,COMMENT,STANDARD,17-108,https://www.fcc.gov/ecfs/search/search-filings/filing/10711021298775,"U.S. Chamber of Commerce, Other associations",Refer to Attachment(s).,1,https://www.fcc.gov/ecfs/document/10711021298775/1,,7/11/2017,U.S. Chamber of Commerce,Telecommunications Industry Association,Citizens Against Government Waste,National Association of Manufacturers,Competitive Enterprise Institute,National Black Chamber of Commerce,,,,,,,,,,,,,,,,,,,,,,,,,,,,,,,,,,,,,,,,,,,,,,,,,,,,,,,,,,,,,,,,,,,,,,,,,,,,,,,,,,,,,,,,,,,,,,,,,,,,,,,,,,,,,,,,,,,,,,,,,,,,,,,,,,,,,,,,,,,,,,,,,,,,,,,,,,,,,,,,,,,,,,,,,,,,,,,,,,,,
Pro,Network,Joint Motion,9/19/2017,MOTION,STANDARD,17-108,https://www.fcc.gov/ecfs/search/search-filings/filing/109192207003170,"National Hispanic Media Coalition, American Civil Liberties Union, American Library Association, CASH Music, Center for Democracy & Technology, Center for Media Justice, Center for Rural Strategies, Color of Change, Common Cause, Fight for the Future, Free Press, Future of Music Coalition, It's Our Economy, National Consumer Law Center, New America's Open Technology Institute, OpenMedia, Popular Resistance, Protect Our Internet, Public Knowledge, United Church of Christ, OC Inc., 18MillionRising.org",Refer to Attachment(s).,46,https://www.fcc.gov/ecfs/document/109192207003170/1,,9/18/2017,National Hispanic Media Coalition,American Civil Liberties Union,American Library Association,CASH Music,Center for Democracy & Technology,Center for Media Justice,Center for Rural Strategies,ColorOfChange,Common Cause,Fight for the Future,Free Press,Future of Music Coalition,It's Our Economy,National Consumer Law Center,New America Foundation,OpenMedia,Popular Resistance,Protect Our Internet,Public Knowledge,United Church of Christ OC,18MillionRising,,,,,,,,,,,,,,,,,,,,,,,,,,,,,,,,,,,,,,,,,,,,,,,,,,,,,,,,,,,,,,,,,,,,,,,,,,,,,,,,,,,,,,,,,,,,,,,,,,,,,,,,,,,,,,,,,,,,,,,,,,,,,,,,,,,,,,,,,,,,,,,,,,,,,,,,,,,,,,,,,,,,,
Pro,Network,Letter,12/7/2017,LETTER,STANDARD,17-108,https://www.fcc.gov/ecfs/search/search-filings/filing/120795134941,"City of Boston, Massachusetts",Refer to Attachment(s).,5,https://www.fcc.gov/ecfs/document/120795134941/1,Mayor's Call for Net Neutrality,12/7/2017,"Mayor Edwin M. Lee, City and County of San Francisco","Mayor Bill de Blasio, City of New York, New York","Mayor Martin J. Walsh, City of Boston, Massachusetts","Mayor E. Denise Simmons, City of Cambridge, Massachusetts","Mayor Jenny A. Durkan, City of Seattle, Washington","Mayor Rahm Emanuel, City of Chicago, Illinois","Mayor Allison Silberberg, City of Alexandria, Virginia","Mayor William Peduto, City of Pittsburgh, Pennsylvania","Mayor Byron Randolph Foley, City of Salem, Virginia","Melvin Kleckner, Town Administrator, Town of Brookline, Massachusetts","Mayor Deborah Frank Feinen, City of Champaign, Illinois","Mayor Andy Berke, City of Chattanooga, Tennessee","Mayor Mary Casillas Salas, City of Chula Vista, California","Mayor David R. Martin, City of Stamford, Connecticut","Mayor Paul Soglin, City of Madison, Wisconsin","Mayor Lucy Vinis, City of Eugene, Oregon","Mayor Lioneld Jordan, City of Fayetteville, Arkansas","Mayor William McLeod, Village of Hoffman Estates, Illinois","Chairman Archibald L. Gillies, Islesboro Board of Selectmen, Town of Islesboro, Maine","Peter D'Errico, Chair of Select Board, Town of Leverett, Massachusetts","Mayor Chris Beutler, City of Lincoln, Nebraska","Mayor Megan Barry, Metropolitan Nashville & Davidson County, Tennessee","Mayor Jon Mitchell, City of New Bedford, Massachusetts","Mayor David J. Narkewicz, City of Northampton, Massachusetts","Mayor Libby Schaaf, City of Oakland, California","Mayor Ted Wheeler, City of Portland, Oregon","Mayor Tom Butt, City of Richmond, California","Mayor Sam Liccardo, City of San Jose, California","Mayor Pauline Russo Cutter, City of San Leandro, California","Zach Friend, Vice Chair, Santa Cruz County Board of Supervisors, Santa Cruz County, California","Mayor Ted Winterer, City of Santa Monica, California","Mayor Joanne Dittes Yepsen, City of Saratoga Springs, New York","Mayor Gary R. McCarthy, City of Schenectady, New York","Mayor Patricia Smith, City of South Portland, Maine","Mayor Christine Lundberg, City of Springfield, Oregon","Mayor Stephanie Miner, City of Syracuse, New York","Mayor Marilyn Strickland, City of Tacoma, Washington","Mayor Diane Wolfe Marlin, City of Urbana, Illinois","Mayor William D. Sessoms, City of Virginia Beach, Virginia","Mayor John Heilman, City of West Hollywood, California","Mayor Gary Resnick, City of Wilton Manors, Florida","Mayor Kathy Sheehan, City of Albany, New York","Mayor Steve Adler, City of Austin, Texas","Mayor Catherine E. Pugh, City of Baltimore, Maryland","Mayor Jesse Arreguin, City of Berkeley, California","Mayor Miro Weinberger, City of Burlington, Vermont","Mayor Robb Davis, City of Davis, California","Board of Supervisors, DeSoto County, Mississippi","Gil Ziffer, Commissioner, City of Tallahassee, Florida","Mayor Jud Ashman, City of Gaithersburg, Maryland","Mayor Patrick Taylor, Town of Highlands, North Carolina","Mayor Derek Dobies, City of Jackson, Michigan","Mayor David Baker, City of Kenmore, Washington","Mayor Eric Garcetti, City of Los Angeles, California","Kathrin Sears, Chair, Marin Telecommunications Agency JPA Supervisor, Board of Supervisors, Marin County, California","Mayor James E. Darling, City of McAllen, Texas","Mayor Anthony P. Falzarano, Town of Putnam, CT","Mayor Domenic J. Sarno, City of Springfield, Massachusetts","Mayor Andrew D. Gillum, City of Tallahassee, Florida","Mayor Sylvester Turner, City of Houston, Texas","Mayor Sly James, City of Kansas City, Missouri","Mayor Mark Stodola, City of Little Rock, Arkansas","President Robert R. Heilman, Village of Mackinaw City, Michigan","Mayor Mark Gamba, City of Milwaukie, Oregon","Isiah Leggett, County Executive, Montgomery County, Maryland","Mayor H. Gregory Scharff, City of Palo Alto, California","Mayor Ron Nirenberg, City of San Antonio, Texas","Mayor Muriel Bowser, District of Columbia",,,,,,,,,,,,,,,,,,,,,,,,,,,,,,,,,,,,,,,,,,,,,,,,,,,,,,,,,,,,,,,,,,,,,,,,,,,,,,,,,,,,,,,,,,,,,,,,,,,,,,,,,,,,,,,,,,,,,,
Pro,Network,Letter,12/13/2017,COMMENT,STANDARD,17-108,https://www.fcc.gov/ecfs/search/search-filings/filing/1213011755845,Sophie Williams,Refer to Attachment(s).,8,https://www.fcc.gov/ecfs/document/1213011755845/1,,3/7/2017,18MillionRising,Access Humboldt,Access,Access Sonoma Broadband,act.tv,Akaku Maui Community Media,Alliance of South Asians Taking Action,Allied Media Projects,Alternate ROOTS,American Association of Law Libraries,American Civil Liberties Union,American Folklore Society,American Library Association,Appalshop,Arts & Democracy,Asamblea de Derechos Civiles,Association of American University Presses,Association of Research Libraries,Benton Foundation,Defending Dissent Foundation,"Brattleboro Community Television, Brattleboro VT",Brown Boi Project,California Center for Rural Policy,CASH Music,Center for Democracy & Technology,Center for Digital Democracy,Center for Media & Democracy - Burlington VT,Center for Media & Democracy,Center for Media Justice,Center for Popular Democracy,Center for Rural Strategies,Central Appalachia Regional Network,Champaign Urbana Citizens for Peace and Justice,Civic Hall,ColorOfChange,Common Cause,Common Frequency,Consumers Union,Courage Campaign,CREDO,Daily Kos,Dance/USA,Demand Progress,Democracy for America,Dignity & Power Now,Easton Community Access Television,Electronic Frontier Foundation,Ella Baker Center for Human Rights,Engine,EveryLibrary,FAIR,Faithful Internet,Fight for the Future,Forward Together,Fractured Atlas,Free Press,Free Speech Coalition,Families Rally for Emancipation & Empowerment,Future of Music Coalition,Generation Justice,Global Action Project,Greater Northshire Access Television,Greenlining Institute,Greenpeace USA,Hardwick Community Television,Highlander Research & Education Center,Hollaback!,Hollow Earth Radio,Hope Community/SPEAC,Illinois Campaign for Prison Phone Justice,Institute for Local Self Reliance,Iraq Veterans Against the War,Kingdom Access Television,KPPP-LP 88.1 FM Radio,KRSM Radio,Lake Champlain Access Television,League of American Orchestras,Line Break Media,Mad River Valley Television,Making Contact,Martinez Street Women's Center,May First/People Link,Media Action Center,Media Action Grassroots Network,Media Alliance,Media Mobilizing Project,MediaVox,Mexican American Opportunity Foundation,Million Hoodies Movement for Justice,MomsRising,Movement Strategy Center,MoveOn,Museums and the Web,National Association of Latino Independent Producers,National Coalition Against Censorship,National Consumer Law Center,National Digital Inclusion Alliance,National Domestic Workers Alliance,National Economic & Social Rights Initiative,National Federation of Community Broadcasters,National Guestworker Alliance,National Hispanic Media Coalition,National Organization for Women,National Performance Network & Visual Artists Network,Native Public Media,Netroots Nation,New America Foundation,New Music USA,New Orleans Workers Center for Racial Justice,Open Access Connections,Open Media & Information Companies Initiative,OpenMedia,OpenTheGovernment.org,Opera America,Other Worlds Other98,Ohio Valley Environmental Coalition,PEN America,People's Action,People's Press Project,Performing Arts Alliance,Philly Community Access Media,Popular Resistance,Presente,Progressive Change Campaign Committee,Progressive Technology Project,Prometheus Radio Project,Public Knowledge,Race Forward,Racial Justice Action Center,Rewire,Right To The City Alliance,RootsAction,RYSE Center,Southerners On New Ground,Southwest Organizing Project,SPNN,Stop LAPD Spying Coalition,Student Power Networks,SumOfUs,Sunlight Foundation,National Alliance for Media Arts + Culture,Authors Guild,Harry Potter Alliance,Media Consortium,The Nation,Theatre Communications Group,The Utility Reform Network,U.S. Department of Arts & Culture,United Church of Christ OC,United Plant Savers,United We Dream,Urban Librarians Unite,Urbana Champaign Independent Media Center,Virginia Rural Health Association,Voices for Racial Justice,Vote Mob,WAFLS,WFNU Frogtown Community Radio,Within Our Lifetime,WITNESS,WNC Communities,"Women, Action & Media!",Women’s Institute for Freedom of the Press,Women’s Media Center,Woodhull Freedom Foundation,Working Narratives,Writers Guild of America West,X-Lab,Young Women United,Civic Action,,,,,,,,,,,,,,,,
Pro,Network,Letter,8/22/2017,LETTER,STANDARD,17-108,https://www.fcc.gov/ecfs/search/search-filings/filing/10822176229704,"18MillionRising.org, American Civil Liberties Union, Center for Democracy & Technology, Center for Media Justice, Center for Rural Strategies, Color of Change, Common Cause, Electronic Frontier Foundation, Fight for the Future, Free Press, Native Public Media, New America’s Open Technology Institute, OpenMedia, Popular Resistance, Public Knowledge, United Church of Christ, OC Inc.",Refer to Attachment(s).,3,https://www.fcc.gov/ecfs/document/10822176229704/1,,8/22/2017,18MillionRising,American Civil Liberties Union,Center for Democracy & Technology,Center for Media Justice,Center for Rural Strategies,ColorOfChange,Common Cause,Electronic Frontier Foundation,Fight for the Future,Free Press,Native Public Media,New America Foundation,OpenMedia,Popular Resistance,Public Knowledge,United Church of Christ OC,,,,,,,,,,,,,,,,,,,,,,,,,,,,,,,,,,,,,,,,,,,,,,,,,,,,,,,,,,,,,,,,,,,,,,,,,,,,,,,,,,,,,,,,,,,,,,,,,,,,,,,,,,,,,,,,,,,,,,,,,,,,,,,,,,,,,,,,,,,,,,,,,,,,,,,,,,,,,,,,,,,,,,,,,,
Pro,Network,Letter,6/27/2017,COMMENT,STANDARD,17-108,https://www.fcc.gov/ecfs/search/search-filings/filing/106271543602165,Electronic Frontier Foundation,Refer to Attachment(s).,2,https://www.fcc.gov/ecfs/document/106271543602165/1,,6/27/2017,Electronic Frontier Foundation,"A Better Wireless, NISP, LLC",Brazos Wifi,Burlington Telecom,CityLink Telecommunications,civanoNET,Coastside.Net,CredoMobile,Cruzio,Cybermesa,Davis Community Network,Data Foundry,DC Access,Digital Service Consultants,Enguity Technology Corp.,Full Channel Labs,Giganews,Golden Frog GmbH,Gorge,GWI,Hubris Communications Inc.,Islesboro Broadband Committee,LMI.net,Monkey Brains,Mother Lode and Goldrush,netBlazr Inc.,Northwest Ohio Broadband,Om Networks,Pacific Internet,Public Access Networks Corp. ,Router12 Networks,SmarterBroadband,Sonic,Spiral Internet,Stephouse Networks,Tekify Fiber & Wireless,Telnexus,Ting Internet,Unwired Ltd,Visionary Communications,Wicked Broadband,Wilson Creek Communications,,,,,,,,,,,,,,,,,,,,,,,,,,,,,,,,,,,,,,,,,,,,,,,,,,,,,,,,,,,,,,,,,,,,,,,,,,,,,,,,,,,,,,,,,,,,,,,,,,,,,,,,,,,,,,,,,,,,,,,,,,,,,,,,,,,,,,,,,,,,,,,,
Pro,Network,Letter,7/17/2017,LETTER,STANDARD,17-108,https://www.fcc.gov/ecfs/search/search-filings/filing/107170915330188,Internet Association,Refer to Attachment(s).,1,https://www.fcc.gov/ecfs/document/107170915330188/1,,7/17/2017,Internet Association,Airbnb,Amazon,Coinbase,Doordash,Dropbox,eBay,Etsy,Expedia,Facebook,Google,Groupon,Handy,IAC,Intuit,LinkedIn,Lyft,Match Group,Microsoft,Monster,Netflix,Pandora,PayPal,Pinterest,Rackspace,Reddit,SalesForce,Snap Inc.,Spotify,SurveyMonkey,Ten-X,TransferWise,TripAdvisor,Turo,Twitter,Uber,Upwork,Yelp,Zenefits,Zynga,,,,,,,,,,,,,,,,,,,,,,,,,,,,,,,,,,,,,,,,,,,,,,,,,,,,,,,,,,,,,,,,,,,,,,,,,,,,,,,,,,,,,,,,,,,,,,,,,,,,,,,,,,,,,,,,,,,,,,,,,,,,,,,,,,,,,,,,,,,,,,,,,,
Pro,Network,Letter,12/7/2017,LETTER,STANDARD,17-108,https://www.fcc.gov/ecfs/search/search-filings/filing/1207567600807,"National League of Cities, The United States Conference of Mayors",Refer to Attachment(s).,2,https://www.fcc.gov/ecfs/document/1207567600807/1,,12/7/2017,National League of Cities,United States Conference of Mayors,,,,,,,,,,,,,,,,,,,,,,,,,,,,,,,,,,,,,,,,,,,,,,,,,,,,,,,,,,,,,,,,,,,,,,,,,,,,,,,,,,,,,,,,,,,,,,,,,,,,,,,,,,,,,,,,,,,,,,,,,,,,,,,,,,,,,,,,,,,,,,,,,,,,,,,,,,,,,,,,,,,,,,,,,,,,,,,,,,,,,,,,
Pro,Network,Letter,8/30/2017,LETTER,STANDARD,17-108,https://www.fcc.gov/ecfs/search/search-filings/filing/10830960630645,"Public Knowledge, American Civil Liberties Union, Consumer Action, Center for Digital Democracy, Center for Democracy and Technology, Consumer Federation of California, Consumer Watchdog, Media Alliance, Privacy Rights Clearinghouse, U.S. PIRG, Consumer Federation of America",Refer to Attachment(s).,9,https://www.fcc.gov/ecfs/document/10830960630645/1,,8/30/2017,Public Knowledge,American Civil Liberties Union,Consumer Action,Center for Digital Democracy,Center for Democracy & Technology,Consumer Federation of California,Consumer Watchdog,Media Alliance,Privacy Rights Clearinghouse,U.S. Public Interest Research Group,Consumer Federation of America,,,,,,,,,,,,,,,,,,,,,,,,,,,,,,,,,,,,,,,,,,,,,,,,,,,,,,,,,,,,,,,,,,,,,,,,,,,,,,,,,,,,,,,,,,,,,,,,,,,,,,,,,,,,,,,,,,,,,,,,,,,,,,,,,,,,,,,,,,,,,,,,,,,,,,,,,,,,,,,,,,,,,,,,,,,,,,,
Pro,Network,Letter,12/4/2017,LETTER,STANDARD,17-108,https://www.fcc.gov/ecfs/search/search-filings/filing/120412818141,"Public Knowledge, The City of New York, 40 Public Interest Organizations",Refer to Attachment(s).,5,https://www.fcc.gov/ecfs/document/120412818141/1,,12/4/2017,Public Knowledge,"Miguel Gamino, Chief Technology Officer of New York City",Electronic Frontier Foundation,Center for Digital Democracy,Institute for Local Self Reliance,Consumer Federation of America,Privacy Rights Clearinghouse,National Consumers League,National Hispanic Media Coalition,Center for Democracy & Technology,Media Alliance,Consumer Action,Consumer Watchdog,Greenlining Institute,Center for Rural Strategies,National Digital Inclusion Alliance,Appalshop,National Consumer Law Center,"Mayor Anthony P. Falzarano, Town of Putnam, CT",Southern California Tribal Chairmen’s Association,Tech Goes Home,St. Paul Community Literacy Consortium,Benton Foundation,Virginia Rural Health Association,Rise Fast,California Center for Rural Policy,Phoenix Public Library,Access Humboldt,Housing Authority of the  County of San Joaquin,Broadband Alliance of  Mendocino County,PowerMyLearning,"IBSA, Inc.",Axiom,Human-I-T,Free Geek,Inclutech,American Library Association,"Kentucky Resources Council, Inc.",Popular Resistance,Akaku Maui Community Media,Free Software Foundation,,,,,,,,,,,,,,,,,,,,,,,,,,,,,,,,,,,,,,,,,,,,,,,,,,,,,,,,,,,,,,,,,,,,,,,,,,,,,,,,,,,,,,,,,,,,,,,,,,,,,,,,,,,,,,,,,,,,,,,,,,,,,,,,,,,,,,,,,,,,,,,,,
Pro,Network,Letter,12/8/2017,LETTER,STANDARD,17-108,https://www.fcc.gov/ecfs/search/search-filings/filing/120841903001,"Union Telephone Co., East Kentucky Network, LLC, Pine Cellular Phones, Inc., Pioneer Telephone Cooperative, Inc.",Refer to Attachment(s).,8,https://www.fcc.gov/ecfs/document/120841903001/1,,12/7/2017,Union Telephone Company,East Kentucky Network,Pine Cellular Phones,Pioneer Telephone Cooperative,,,,,,,,,,,,,,,,,,,,,,,,,,,,,,,,,,,,,,,,,,,,,,,,,,,,,,,,,,,,,,,,,,,,,,,,,,,,,,,,,,,,,,,,,,,,,,,,,,,,,,,,,,,,,,,,,,,,,,,,,,,,,,,,,,,,,,,,,,,,,,,,,,,,,,,,,,,,,,,,,,,,,,,,,,,,,,,,,,,,,,
Anti,Network,Letter,5/9/2017,NOTICE OF EXPARTE,STANDARD,17-108,https://www.fcc.gov/ecfs/search/search-filings/filing/1050997938918,70 WISPs,Refer to Attachment(s).,6,https://www.fcc.gov/ecfs/document/1050997938918/1,"70 WISPs (without A Better Wireless, Global Vision, Unwired Ltd)",5/9/2017,Amplex,Wave Wireless,"WiLogic, Inc.",Grand Avenue Broadband,REACH4 Communications,New Wave Net Corp.,Imagine Networks LLC,OACYS Technology,Fourway Computer Products,"Metroplex Communications, Inc.",Lighthouse.Net,Portative Technologies,Snappy Internet & Telecom,BlountBroadBand LLC,AirLink Internet Services,New Lisbon Broadband & Communications,"First Step Internet, LLC",Wavelinc Communications LLC,Winters Broadband LLC,ALSAT Wireless,Tnet Broadband Internet,101Netlink.com,"AcelaNet, LLC",FreedomNet Solutions,QxCommunications,"Excel.Net, Inc.",Intelligent Computing Solutions,PennWisp,Celerity Networks LLC,Celerity Broadband LLC,Rural Broadband Network Services,Mimbres Communications,Wavz,"Razzo Link, Inc.",Nextera Communications,Oregon Online,BEH Communications,Net-Change.Com,Broadband Corp.,Advanced Wireless,Washington Broadband,"RidgeComms, Inc.",Ridge Wireless Inc.,CMS Internet LLC,BridgeNet Wireless,"Southern Internet, Inc.",Wyoming.com,Internet Communications,"Remotely Located, Inc.",NTInet Inc.,"CloudWyze, Inc.",OnlineNW,L.R. Communications Inc.,GoBrolly.com,DSLbyAir,Grand County Internet Services Inc.,"360 Communications, Inc.",Cybernet1,Watch Communications,"Meridian Solutions, LLC",Aristotle.net,Camp Communication Services/West Michigan Wireless ISP,Co-Owner Amarillo Wireless,Cape Ann Communications,"GigaBeam Networks, LLC",Fire2Wire,Colorado Central Telecom,,,,,,,,,,,,,,,,,,,,,,,,,,,,,,,,,,,,,,,,,,,,,,,,,,,,,,,,,,,,,,,,,,,,,,,,,,,,,,,,,,,,,,,,,,,,,,,,,,,,,,,,,,,,,,,,,,,,,,,
Anti,Network,Letter,5/11/2017,LETTER,STANDARD,17-108,https://www.fcc.gov/ecfs/search/search-filings/filing/105110692413807,Nineteen Municipal ISPs,Refer to Attachment(s).,4,https://www.fcc.gov/ecfs/document/105110692413807/1,19 Municipal ISPs,5/11/2017,"BELD Broadband, Braintree, MA","Bagley Public Utilities, Bagley, MN","Electric & Telecommunications, City of Monroe, GA","Oberlin Cable Co-op, Oberlin, OH","Wyandotte Cable, Wyandotte, MI","Murray Electric System, Murray, KY","Laurens Municipal Communications Utility, Laurens, IA","CityLink - City of Wadsworth, Wadsworth, OH","Scottsboro Electric Power Board, Scottsboro, AL","Spencer Municipal Utilities, Spencer, IA","Auburn Essential Services, Auburn, IN","Conway Corporation, Conway, AR","Frankfort Plant Board, Frankfort, KY","EastonVelocity, A Service of Easton Utilities, Easton, MD","Muscatine Power & Water, Muscatine, IA","Shrewsbury Electric & Cable Operations, Shrewsbury, MA","Tullahoma Utilities Board, Tullahoma, TN","City of Bellevue, IA","Bardstown Cable Internet, Bardstown, KY",,,,,,,,,,,,,,,,,,,,,,,,,,,,,,,,,,,,,,,,,,,,,,,,,,,,,,,,,,,,,,,,,,,,,,,,,,,,,,,,,,,,,,,,,,,,,,,,,,,,,,,,,,,,,,,,,,,,,,,,,,,,,,,,,,,,,,,,,,,,,,,,,,,,,,,,,,,,,,,,,,,,,,,
Anti,Network,Letter,5/11/2017,LETTER,STANDARD,17-108,https://www.fcc.gov/ecfs/search/search-filings/filing/1051137268642,"Bluegrass Cellular, Cavalier Wireless, Cellcom, Cellularone, King Street Wireless, Pioneer Cellular, Tristar License Group, LLC",Refer to Attachment(s).,2,https://www.fcc.gov/ecfs/document/1051137268642/1,,5/11/2017,Bluegrass Cellular,King Street Wireless,"Smith Bagley, Inc.",Tristar License Group,Cellcom,Pioneer Cellular,Cavalier Wireless,,,,,,,,,,,,,,,,,,,,,,,,,,,,,,,,,,,,,,,,,,,,,,,,,,,,,,,,,,,,,,,,,,,,,,,,,,,,,,,,,,,,,,,,,,,,,,,,,,,,,,,,,,,,,,,,,,,,,,,,,,,,,,,,,,,,,,,,,,,,,,,,,,,,,,,,,,,,,,,,,,,,,,,,,,,,,,,,,,,
Anti,Network,Letter,8/30/2017,LETTER,STANDARD,17-108,https://www.fcc.gov/ecfs/search/search-filings/filing/1083042023298,Coalition of 15 High-Tech Manufactuers,Refer to Attachment(s).,3,https://www.fcc.gov/ecfs/document/1083042023298/1,,8/30/2017,Coalition of 15 High-Tech Manufacturers,ADTRAN,Alticast,ARRIS,Blonder Tongue,Cisco,CommScope Network,Corning,Ericsson,Infinera,Juniper Networks,KGPCo,Nokia,Panasonic,Qualcomm,Walker & Associates,,,,,,,,,,,,,,,,,,,,,,,,,,,,,,,,,,,,,,,,,,,,,,,,,,,,,,,,,,,,,,,,,,,,,,,,,,,,,,,,,,,,,,,,,,,,,,,,,,,,,,,,,,,,,,,,,,,,,,,,,,,,,,,,,,,,,,,,,,,,,,,,,,,,,,,,,,,,,,,,,,,,,,,,,,
Anti,Network,Letter,5/10/2017,LETTER,STANDARD,17-108,https://www.fcc.gov/ecfs/search/search-filings/filing/105101220325459,"Fred Campbell, Daniel Berninger, Mike Wendy",Refer to Attachment(s).,2,https://www.fcc.gov/ecfs/document/105101220325459/1,,5/10/2017,MediaFreedom,Tech Knowledge,Voice Communication Exchange Committee,,,,,,,,,,,,,,,,,,,,,,,,,,,,,,,,,,,,,,,,,,,,,,,,,,,,,,,,,,,,,,,,,,,,,,,,,,,,,,,,,,,,,,,,,,,,,,,,,,,,,,,,,,,,,,,,,,,,,,,,,,,,,,,,,,,,,,,,,,,,,,,,,,,,,,,,,,,,,,,,,,,,,,,,,,,,,,,,,,,,,,,
Pro,Network,Motion,7/20/2017,MOTION,STANDARD,17-108,https://www.fcc.gov/ecfs/search/search-filings/filing/107200870620459,"Public Knowledge, Common Cause",Refer to Attachment(s).,143,https://www.fcc.gov/ecfs/document/107200870620459/1,,7/19/2017,Public Knowledge,Common Cause,,,,,,,,,,,,,,,,,,,,,,,,,,,,,,,,,,,,,,,,,,,,,,,,,,,,,,,,,,,,,,,,,,,,,,,,,,,,,,,,,,,,,,,,,,,,,,,,,,,,,,,,,,,,,,,,,,,,,,,,,,,,,,,,,,,,,,,,,,,,,,,,,,,,,,,,,,,,,,,,,,,,,,,,,,,,,,,,,,,,,,,,
Pro,Network,Motion,8/2/2017,MOTION FOR EXTENSION OF TIME,STANDARD,17-108,https://www.fcc.gov/ecfs/search/search-filings/filing/1080223656569,"Public Knowledge, Access Now, American Civil Liberties Union, Computer & Communications Industry Association, Consumers Union, Electronic Frontier Foundation, Engine Advocacy, National Consumer Law Center, World Wide Web Foundation, Writers Guild of America West",Refer to Attachment(s).,9,https://www.fcc.gov/ecfs/document/1080223656569/1,,8/1/2017,Public Knowledge,Access,American Civil Liberties Union,Computer & Communications Industry Association,Consumers Union,Electronic Frontier Foundation,Engine,National Consumer Law Center,World Wide Web Foundation,Writers Guild of America West,,,,,,,,,,,,,,,,,,,,,,,,,,,,,,,,,,,,,,,,,,,,,,,,,,,,,,,,,,,,,,,,,,,,,,,,,,,,,,,,,,,,,,,,,,,,,,,,,,,,,,,,,,,,,,,,,,,,,,,,,,,,,,,,,,,,,,,,,,,,,,,,,,,,,,,,,,,,,,,,,,,,,,,,,,,,,,,,
Anti,Network,Opposition to Motion,8/10/2017,OPPOSITION,STANDARD,17-108,https://www.fcc.gov/ecfs/search/search-filings/filing/1081083338971,"CTIA, NCTA, USTelecom",Refer to Attachment(s).,4,https://www.fcc.gov/ecfs/document/1081083338971/1,,8/10/2017,Cellular Telephone Industries Association,National Cable & Telecommunications Association,United States Telecom Association,,,,,,,,,,,,,,,,,,,,,,,,,,,,,,,,,,,,,,,,,,,,,,,,,,,,,,,,,,,,,,,,,,,,,,,,,,,,,,,,,,,,,,,,,,,,,,,,,,,,,,,,,,,,,,,,,,,,,,,,,,,,,,,,,,,,,,,,,,,,,,,,,,,,,,,,,,,,,,,,,,,,,,,,,,,,,,,,,,,,,,,
Anti,Network,Opposition to Motion,9/28/2017,OPPOSITION,STANDARD,17-108,https://www.fcc.gov/ecfs/search/search-filings/filing/109280026624434,"NCTA - The Internet & Television Association, USTelecom",Refer to Attachment(s).,8,https://www.fcc.gov/ecfs/document/109280026624434/1,,9/28/2017,National Cable & Telecommunications Association,United States Telecom Association,,,,,,,,,,,,,,,,,,,,,,,,,,,,,,,,,,,,,,,,,,,,,,,,,,,,,,,,,,,,,,,,,,,,,,,,,,,,,,,,,,,,,,,,,,,,,,,,,,,,,,,,,,,,,,,,,,,,,,,,,,,,,,,,,,,,,,,,,,,,,,,,,,,,,,,,,,,,,,,,,,,,,,,,,,,,,,,,,,,,,,,,
Pro,Network,Reply Comments,8/30/2017,REPLY TO COMMENTS,STANDARD,17-108,https://www.fcc.gov/ecfs/search/search-filings/filing/1083094796388,"AACC, AASCU, ACE, AAU, APLU, ARL, EDUCAUSE, NACUBO, NAICU",Refer to Attachment(s).,22,https://www.fcc.gov/ecfs/document/1083094796388/1,,8/30/2017,American Council on Education,American Association of Community Colleges,American Association of State Colleges & Universities,Association of American Universities,Association of Public and Land-grant Universities,National Association of Independent Colleges & Universities,EDUCAUSE,Association of Research Libraries,National Association of College & University Business Officers,,,,,,,,,,,,,,,,,,,,,,,,,,,,,,,,,,,,,,,,,,,,,,,,,,,,,,,,,,,,,,,,,,,,,,,,,,,,,,,,,,,,,,,,,,,,,,,,,,,,,,,,,,,,,,,,,,,,,,,,,,,,,,,,,,,,,,,,,,,,,,,,,,,,,,,,,,,,,,,,,,,,,,,,,,,,,,,,,
Pro,Network,Reply Comments,8/29/2017,REPLY TO COMMENTS,STANDARD,17-108,https://www.fcc.gov/ecfs/search/search-filings/filing/10829606827168,"Barbara A. Cherry, Julien Mailland, Matt Pierce",Refer to Attachment(s).,41,https://www.fcc.gov/ecfs/document/10829606827168/1,,8/29/2017,"Barbara Cherry, Indiana University Bloomington","Julien Mailland, Indiana Univ.","Matt Pierce, Indiana Univ.",,,,,,,,,,,,,,,,,,,,,,,,,,,,,,,,,,,,,,,,,,,,,,,,,,,,,,,,,,,,,,,,,,,,,,,,,,,,,,,,,,,,,,,,,,,,,,,,,,,,,,,,,,,,,,,,,,,,,,,,,,,,,,,,,,,,,,,,,,,,,,,,,,,,,,,,,,,,,,,,,,,,,,,,,,,,,,,,,,,,,,,
